{"schemaVersion":"2.0","id":"performance-30-45-3","title":"30 节点性能样例","description":"确定性合成数据：30 个节点、45 条边、3 个组；不代表真实业务系统。","view":{"kind":"overview","direction":"RIGHT","theme":"light","primaryPath":["e001","e002","e003","e004","e005","e006","e007","e008","e009","e010","e011","e012","e013","e014","e015","e016","e017","e018","e019","e020","e021","e022","e023","e024","e025","e026","e027","e028","e029"]},"nodes":[{"id":"n001","kind":"process","label":"组件 001","summary":"处理请求与上下文","evidenceStatus":"confirmed","groupId":"g01"},{"id":"n002","kind":"process","label":"组件 002","summary":"保留原始关系","evidenceStatus":"confirmed","groupId":"g01"},{"id":"n003","kind":"process","label":"组件 003","summary":"保留原始关系","evidenceStatus":"confirmed","groupId":"g01"},{"id":"n004","kind":"process","label":"组件 004","summary":"保留原始关系","evidenceStatus":"confirmed","groupId":"g01"},{"id":"n005","kind":"process","label":"组件 005","summary":"处理请求与上下文","evidenceStatus":"confirmed","groupId":"g01"},{"id":"n006","kind":"process","label":"组件 006","summary":"保留原始关系","evidenceStatus":"confirmed","groupId":"g01"},{"id":"n007","kind":"process","label":"组件 007","summary":"保留原始关系","evidenceStatus":"confirmed","groupId":"g01"},{"id":"n008","kind":"process","label":"组件 008","summary":"保留原始关系","evidenceStatus":"confirmed","groupId":"g01"},{"id":"n009","kind":"store","label":"组件 009","summary":"处理请求与上下文","evidenceStatus":"confirmed","groupId":"g01"},{"id":"n010","kind":"process","label":"组件 010","summary":"保留原始关系","evidenceStatus":"confirmed","groupId":"g01"},{"id":"n011","kind":"process","label":"组件 011","summary":"保留原始关系","evidenceStatus":"confirmed","groupId":"g02"},{"id":"n012","kind":"process","label":"组件 012","summary":"保留原始关系","evidenceStatus":"confirmed","groupId":"g02"},{"id":"n013","kind":"process","label":"组件 013","summary":"处理请求与上下文","evidenceStatus":"confirmed","groupId":"g02"},{"id":"n014","kind":"process","label":"组件 014","summary":"保留原始关系","evidenceStatus":"confirmed","groupId":"g02"},{"id":"n015","kind":"process","label":"组件 015","summary":"保留原始关系","evidenceStatus":"confirmed","groupId":"g02"},{"id":"n016","kind":"process","label":"组件 016","summary":"保留原始关系","evidenceStatus":"confirmed","groupId":"g02"},{"id":"n017","kind":"process","label":"组件 017","summary":"处理请求与上下文","evidenceStatus":"confirmed","groupId":"g02"},{"id":"n018","kind":"store","label":"组件 018","summary":"保留原始关系","evidenceStatus":"confirmed","groupId":"g02"},{"id":"n019","kind":"process","label":"组件 019","summary":"保留原始关系","evidenceStatus":"confirmed","groupId":"g02"},{"id":"n020","kind":"process","label":"组件 020","summary":"保留原始关系","evidenceStatus":"confirmed","groupId":"g02"},{"id":"n021","kind":"process","label":"组件 021","summary":"处理请求与上下文","evidenceStatus":"confirmed","groupId":"g03"},{"id":"n022","kind":"process","label":"组件 022","summary":"保留原始关系","evidenceStatus":"confirmed","groupId":"g03"},{"id":"n023","kind":"process","label":"组件 023","summary":"保留原始关系","evidenceStatus":"confirmed","groupId":"g03"},{"id":"n024","kind":"process","label":"组件 024","summary":"保留原始关系","evidenceStatus":"confirmed","groupId":"g03"},{"id":"n025","kind":"process","label":"组件 025","summary":"处理请求与上下文","evidenceStatus":"confirmed","groupId":"g03"},{"id":"n026","kind":"process","label":"组件 026","summary":"保留原始关系","evidenceStatus":"confirmed","groupId":"g03"},{"id":"n027","kind":"store","label":"组件 027","summary":"保留原始关系","evidenceStatus":"confirmed","groupId":"g03"},{"id":"n028","kind":"process","label":"组件 028","summary":"保留原始关系","evidenceStatus":"confirmed","groupId":"g03"},{"id":"n029","kind":"process","label":"组件 029","summary":"处理请求与上下文","evidenceStatus":"confirmed","groupId":"g03"},{"id":"n030","kind":"process","label":"组件 030","summary":"保留原始关系","evidenceStatus":"confirmed","groupId":"g03"}],"groups":[{"id":"g01","label":"处理区域 1"},{"id":"g02","label":"处理区域 2"},{"id":"g03","label":"处理区域 3"}],"edges":[{"id":"e001","source":"n001","target":"n002","kind":"control","directed":true,"evidenceStatus":"confirmed"},{"id":"e002","source":"n002","target":"n003","kind":"control","directed":true,"evidenceStatus":"confirmed"},{"id":"e003","source":"n003","target":"n004","kind":"control","directed":true,"evidenceStatus":"confirmed"},{"id":"e004","source":"n004","target":"n005","kind":"control","directed":true,"evidenceStatus":"confirmed"},{"id":"e005","source":"n005","target":"n006","kind":"control","directed":true,"evidenceStatus":"confirmed"},{"id":"e006","source":"n006","target":"n007","kind":"control","directed":true,"evidenceStatus":"confirmed"},{"id":"e007","source":"n007","target":"n008","kind":"control","directed":true,"evidenceStatus":"confirmed"},{"id":"e008","source":"n008","target":"n009","kind":"control","directed":true,"evidenceStatus":"confirmed"},{"id":"e009","source":"n009","target":"n010","kind":"control","directed":true,"evidenceStatus":"confirmed"},{"id":"e010","source":"n010","target":"n011","kind":"control","directed":true,"evidenceStatus":"confirmed"},{"id":"e011","source":"n011","target":"n012","kind":"control","directed":true,"evidenceStatus":"confirmed"},{"id":"e012","source":"n012","target":"n013","kind":"control","directed":true,"evidenceStatus":"confirmed"},{"id":"e013","source":"n013","target":"n014","kind":"control","directed":true,"evidenceStatus":"confirmed"},{"id":"e014","source":"n014","target":"n015","kind":"control","directed":true,"evidenceStatus":"confirmed"},{"id":"e015","source":"n015","target":"n016","kind":"control","directed":true,"evidenceStatus":"confirmed"},{"id":"e016","source":"n016","target":"n017","kind":"control","directed":true,"evidenceStatus":"confirmed"},{"id":"e017","source":"n017","target":"n018","kind":"control","directed":true,"evidenceStatus":"confirmed"},{"id":"e018","source":"n018","target":"n019","kind":"control","directed":true,"evidenceStatus":"confirmed"},{"id":"e019","source":"n019","target":"n020","kind":"control","directed":true,"evidenceStatus":"confirmed"},{"id":"e020","source":"n020","target":"n021","kind":"control","directed":true,"evidenceStatus":"confirmed"},{"id":"e021","source":"n021","target":"n022","kind":"control","directed":true,"evidenceStatus":"confirmed"},{"id":"e022","source":"n022","target":"n023","kind":"control","directed":true,"evidenceStatus":"confirmed"},{"id":"e023","source":"n023","target":"n024","kind":"control","directed":true,"evidenceStatus":"confirmed"},{"id":"e024","source":"n024","target":"n025","kind":"control","directed":true,"evidenceStatus":"confirmed"},{"id":"e025","source":"n025","target":"n026","kind":"control","directed":true,"evidenceStatus":"confirmed"},{"id":"e026","source":"n026","target":"n027","kind":"control","directed":true,"evidenceStatus":"confirmed"},{"id":"e027","source":"n027","target":"n028","kind":"control","directed":true,"evidenceStatus":"confirmed"},{"id":"e028","source":"n028","target":"n029","kind":"control","directed":true,"evidenceStatus":"confirmed"},{"id":"e029","source":"n029","target":"n030","kind":"control","directed":true,"evidenceStatus":"confirmed"},{"id":"e030","source":"n001","target":"n029","kind":"feedback","directed":true,"evidenceStatus":"confirmed","label":"反馈"},{"id":"e031","source":"n002","target":"n004","kind":"dependency","directed":true,"evidenceStatus":"confirmed"},{"id":"e032","source":"n003","target":"n005","kind":"data","directed":true,"evidenceStatus":"confirmed"},{"id":"e033","source":"n004","target":"n006","kind":"dependency","directed":true,"evidenceStatus":"confirmed"},{"id":"e034","source":"n005","target":"n007","kind":"data","directed":true,"evidenceStatus":"confirmed"},{"id":"e035","source":"n006","target":"n008","kind":"dependency","directed":true,"evidenceStatus":"confirmed"},{"id":"e036","source":"n007","target":"n009","kind":"data","directed":true,"evidenceStatus":"confirmed"},{"id":"e037","source":"n008","target":"n010","kind":"dependency","directed":true,"evidenceStatus":"confirmed"},{"id":"e038","source":"n009","target":"n011","kind":"data","directed":true,"evidenceStatus":"confirmed"},{"id":"e039","source":"n010","target":"n012","kind":"dependency","directed":true,"evidenceStatus":"confirmed"},{"id":"e040","source":"n011","target":"n013","kind":"data","directed":true,"evidenceStatus":"confirmed"},{"id":"e041","source":"n012","target":"n010","kind":"feedback","directed":true,"evidenceStatus":"confirmed","label":"反馈"},{"id":"e042","source":"n013","target":"n015","kind":"data","directed":true,"evidenceStatus":"confirmed"},{"id":"e043","source":"n014","target":"n016","kind":"dependency","directed":true,"evidenceStatus":"confirmed"},{"id":"e044","source":"n015","target":"n017","kind":"data","directed":true,"evidenceStatus":"confirmed"},{"id":"e045","source":"n016","target":"n018","kind":"dependency","directed":true,"evidenceStatus":"confirmed"}]}