{
  "schemaVersion": "2.0",
  "id": "package-check",
  "title": "独立安装验证",
  "view": {
    "kind": "flow",
    "direction": "DOWN",
    "theme": "light"
  },
  "groups": [],
  "nodes": [
    {
      "id": "start",
      "kind": "start",
      "label": "收到请求"
    },
    {
      "id": "gate",
      "kind": "decision",
      "label": "校验通过？"
    },
    {
      "id": "done",
      "kind": "end",
      "label": "返回结果"
    },
    {
      "id": "error",
      "kind": "end",
      "label": "返回错误"
    }
  ],
  "edges": [
    {
      "id": "e1",
      "source": "start",
      "target": "gate",
      "kind": "control",
      "directed": true
    },
    {
      "id": "e2",
      "source": "gate",
      "target": "done",
      "kind": "control",
      "directed": true,
      "label": "通过"
    },
    {
      "id": "e3",
      "source": "gate",
      "target": "error",
      "kind": "exception",
      "directed": true,
      "label": "不通过"
    }
  ]
}