{
  "schemaVersion": "2.0",
  "id": "after",
  "title": "After · 边界明确与规划扩展",
  "description": "保持相同前端 / API / 数据库基线；新增 LLM 节点与连接明确标为规划，不能解释成仅更换视觉样式。",
  "view": {
    "kind": "overview",
    "direction": "DOWN",
    "theme": "light",
    "primaryPath": [
      "frontend-api",
      "api-database"
    ]
  },
  "groups": [
    {
      "id": "client-layer",
      "label": "客户端边界"
    },
    {
      "id": "application-layer",
      "label": "应用边界"
    },
    {
      "id": "data-layer",
      "label": "数据边界"
    }
  ],
  "nodes": [
    {
      "id": "frontend",
      "kind": "process",
      "label": "前端",
      "evidenceStatus": "confirmed",
      "groupId": "client-layer",
      "summary": "请求入口",
      "details": "与 Before 的 frontend 为同一职责和粒度。保留原 Client Layer 中 Browser / Mobile / Prompt UI 的来源含义。",
      "sources": [
        {
          "path": "tests/fixtures/legacy/system-blueprint-before-after.svg"
        }
      ]
    },
    {
      "id": "api",
      "kind": "process",
      "label": "API",
      "evidenceStatus": "confirmed",
      "groupId": "application-layer",
      "summary": "应用处理",
      "details": "与 Before 的 api 为同一基线；原 Application Layer 的 routing/workflow/tool runtime 保留为可继续细分的职责说明，不声称已经实现。"
    },
    {
      "id": "database",
      "kind": "store",
      "label": "数据库",
      "evidenceStatus": "confirmed",
      "groupId": "data-layer",
      "summary": "业务记录",
      "details": "与 Before 的 database 为同一数据职责。原 Data & Memory 的 plans/trips/summaries/preferences/recall 保留在此作为可能的数据内容，不宣称当前已存在对应数据库 schema 或自动记忆机制。"
    },
    {
      "id": "llm",
      "kind": "external",
      "label": "LLM 扩展",
      "evidenceStatus": "planned",
      "groupId": "application-layer",
      "summary": "新增模型能力",
      "details": "来自旧 After 中单独出现的 LLM 概念。此版明确将其标为新增规划；Before 不含此能力，不能将新增业务能力包装成等价换肤。"
    }
  ],
  "edges": [
    {
      "id": "frontend-api",
      "source": "frontend",
      "target": "api",
      "kind": "dependency",
      "directed": true,
      "evidenceStatus": "assumed",
      "label": "应用请求"
    },
    {
      "id": "api-database",
      "source": "api",
      "target": "database",
      "kind": "data",
      "directed": true,
      "evidenceStatus": "assumed",
      "label": "业务读写"
    },
    {
      "id": "api-llm",
      "source": "api",
      "target": "llm",
      "kind": "dependency",
      "directed": true,
      "evidenceStatus": "planned",
      "label": "新增模型调用"
    },
    {
      "id": "llm-api",
      "source": "llm",
      "target": "api",
      "kind": "data",
      "directed": true,
      "evidenceStatus": "planned",
      "label": "生成结果"
    }
  ]
}
